<?xml version="1.0" encoding="UTF-8"?>
<population xmlns="http://www.matsim.org/files/dtd"
            xmlns:xsi="http://www.w3.org/2001/XMLSchema-instance"
            xsi:schemaLocation="http://www.matsim.org/files/dtd Population.xsd">
    <metadata>
        <total_population>100000</total_population>
        <population_statistics>
            <!-- Medical Workers -->
            <personal_category id="Medical workers" total="15000" proportion="0.15">
                <role id="Patient Diagnosis" count="5000" proportion="0.33" />
                <role id="Surgery" count="5000" proportion="0.33" />
                <role id="Patient Transport" count="3000" proportion="0.2" />
                <role id="First Aid" count="2000" proportion="0.14" />
            </personal_category>

            <!-- Firefighters -->
            <personal_category id="Firefighters" total="10000" proportion="0.10">
                <role id="Fire Suppression" count="4000" proportion="0.4" />
                <role id="Rescue Operations" count="3000" proportion="0.3" />
                <role id="Evacuation Support" count="2000" proportion="0.2" />
                <role id="First Aid" count="1000" proportion="0.1" />
            </personal_category>

            <!-- Soldiers -->
            <personal_category id="Soldiers" total="20000" proportion="0.2">
                <role id="Search and Rescue" count="5000" proportion="0.25" />
                <role id="Logistics Support" count="5000" proportion="0.25" />
                <role id="Security and Stability Management" count="4000" proportion="0.2" />
                <role id="Maintenance and Technical Support" count="3000" proportion="0.15" />
                <role id="First Aid" count="2000" proportion="0.1" />
                <role id="Patient Transport" count="1000" proportion="0.05" />
            </personal_category>

            <!-- Police -->
            <personal_category id="Police" total="10000" proportion="0.10">
                <role id="Evacuation Support" count="3000" proportion="0.3" />
                <role id="Traffic Management" count="3000" proportion="0.3" />
                <role id="Law Enforcement" count="2000" proportion="0.2" />
                <role id="Rescue Support" count="2000" proportion="0.2" />
            </personal_category>

            <!-- Journalists -->
            <personal_category id="Journalists" total="5000" proportion="0.05">
                <role id="Field Reporting" count="5000" proportion="1.0" />
            </personal_category>

            <!-- Bus Drivers -->
            <personal_category id="Bus Drivers" total="5000" proportion="0.05">
                <role id="Evacuee Transport" count="4000" proportion="0.8" />
                <role id="Rescue Transport" count="1000" proportion="0.2" />
            </personal_category>

            <!-- Facility Managers -->
            <personal_category id="Facility Managers" total="5000" proportion="0.05">
                <role id="Facility Inspection" count="3000" proportion="0.6" />
                <role id="Temporary Facility Management" count="2000" proportion="0.4" />
            </personal_category>

            <!-- Heavy Equipment Operators -->
            <personal_category id="Heavy Equipment Operators" total="5000" proportion="0.05">
                <role id="Debris Removal" count="2000" proportion="0.4" />
                <role id="Rescue Operations" count="2000" proportion="0.4" />
                <role id="Road Repair" count="1000" proportion="0.2" />
            </personal_category>

            <!-- Volunteers -->
            <personal_category id="Volunteers" total="15000" proportion="0.15">
                <role id="Relief Goods Distribution" count="7000" proportion="0.47" />
                <role id="Shelter Support" count="5000" proportion="0.33" />
                <role id="Rescue Operations Support" count="3000" proportion="0.2" />
            </personal_category>

            <!-- Casualties -->
            <personal_category id="Casualties" total="15000" proportion="0.15">
                <role id="Minor First Aid Request" count="10000" proportion="0.67" />
                <role id="Serious First Aid Request" count="5000" proportion="0.33" />
            </personal_category>

            <!-- Civilians -->
            <personal_category id="Civilians" total="20000" proportion="0.2">
                <role id="Immediate Evacuation" count="10000" proportion="0.5" />
                <role id="Move After Securing Safety" count="5000" proportion="0.25" />
                <role id="Requesting Rescue" count="5000" proportion="0.25" />
            </personal_category>
        </population_statistics>
    </metadata>

    <!-- 의료종사자 -->
    <personal_category id="MedicalWorkers" final_destination="안전 확보 지역">
        <attributes>
            <attribute name="Accessibility">
                <focus>경로가 통행 가능하고 안전한지 확인</focus>
                <key_elements>장애물(예: 잔해, 홍수) 확인, 차량 통행 적합성 검토, 교통 체증 회피</key_elements>
                <tools>GPS 또는 지도 활용하여 실시간 업데이트 확인</tools>
                <default>최적의 접근 경로 선택</default>
            </attribute>
            <attribute name="ProximityToResources">
                <focus>가장 가까운 필요한 장소로 연결되는 경로 선택</focus>
                <key_elements>병원, 대피소, 또는 공급 지점까지의 거리 확인, 우선적으로 필요한 지역 선정</key_elements>
                <tools>지역 지도를 통한 확인</tools>
                <default>자원 근접성이 높은 경로 우선</default>
            </attribute>
            <attribute name="Safety">
                <focus>팀과 환자의 위험 최소화</focus>
                <key_elements>재난 위험 지역, 분쟁 지역, 불안정한 인프라 회피</key_elements>
                <tools>현장 점검 및 사전 경로 조사</tools>
                <default>안전성이 높은 경로 선택</default>
            </attribute>
            <attribute name="PriorityAreas">
                <focus>가장 긴급한 도움이 필요한 지역 지원</focus>
                <key_elements>부상자 심각성, 다른 응급 구조 팀과의 협력, 중복 노력 방지</key_elements>
                <tools>우선순위 설정 도구 활용</tools>
                <default>긴급 지역 우선</default>
            </attribute>
            <attribute name="SpeedAndTime">
                <focus>목적지까지 가장 빠른 경로 선택</focus>
                <key_elements>짧은 경로보다 명확한 경로 선호, 필요 시 공중 운송 이용</key_elements>
                <tools>교통 상황 실시간 업데이트</tools>
                <default>최단 시간 경로 우선</default>
            </attribute>
            <attribute name="Communication">
                <focus>정확하고 최신 정보를 바탕으로 결정</focus>
                <key_elements>지휘본부와의 협력, 무전기 또는 통신 도구 사용</key_elements>
                <tools>무전기, 위성통신 도구</tools>
                <default>효율적 정보 공유</default>
            </attribute>
        </attributes>
        <roles>
            <role id="PatientDiagnosis">
                <person id="MD1">
                    <name>의사 A</name>
                    <attributes>
                        <attribute name="Accessibility">안전하고 접근 가능한 경로</attribute>
                        <attribute name="ProximityToResources">가장 가까운 병원 접근</attribute>
                        <attribute name="Safety">분쟁 지역 회피</attribute>
                        <attribute name="PriorityAreas">응급 진단 필요 환자</attribute>
                        <attribute name="SpeedAndTime">빠르게 환자 위치 도달</attribute>
                        <attribute name="Communication">의료 본부와 실시간 협력</attribute>
                    </attributes>
                    <plan>
                        <activity destination="재난지역">
                        <destination_links>link_1, link_2</destination_links>
                        </activity>
                        <transport_mode>앰블런스</transport_mode>
                        <activity destination="병원">
                        <destination_links>link_3, link_4</destination_links>
                        </activity>
                    </plan>
                </person>
                <person id="MD2">
                    <name>의사 B</name>
                    <attributes>
                        <attribute name="Accessibility">장애물 없는 경로 확보</attribute>
                        <attribute name="ProximityToResources">필요 물자와 가까운 위치</attribute>
                        <attribute name="Safety">안전 지역 우선</attribute>
                        <attribute name="PriorityAreas">응급 환자 진단</attribute>
                        <attribute name="SpeedAndTime">최단 시간에 이동</attribute>
                        <attribute name="Communication">팀 간 협조 유지</attribute>
                    </attributes>
                    <plan>
                        <activity destination="안전지역">
                            <destination_links>link_5, link_6</destination_links>
                        </activity>
                        <transport_mode>개인차량</transport_mode>
                        <activity destination="병원">
                            <destination_links>link_7, link_8</destination_links>
                        </activity>
                    </plan>
                </person>
                <person id="MD3">
                    <name>의사 C</name>
                    <attributes>
                        <attribute name="Accessibility">장애물 없는 경로 확보</attribute>
                        <attribute name="ProximityToResources">필요 물자와 가까운 위치</attribute>
                        <attribute name="Safety">안전 지역 우선</attribute>
                        <attribute name="PriorityAreas">응급 환자 진단</attribute>
                        <attribute name="SpeedAndTime">최단 시간에 이동</attribute>
                        <attribute name="Communication">팀 간 협조 유지</attribute>
                    </attributes>
                    <plan>
                            <activity destination="군대">
                                <destination_links>link_13, link_14</destination_links>
                            </activity>
                            <transport_mode>군용 차량</transport_mode>
                            <activity destination="재난지역">
                                <destination_links>link_15, link_16</destination_links>
                            </activity>